{
  "version": 1,
  "detection_batch_sha256": "d6164a95c617d0f698cd003328cd85d8e5cae4402950b848e2605c52a33c2a6b",
  "comparison_sha256": "1dbeaac03df793039a7787e985ef90aa02b4030a69cd8a49466cbb84e050ca3d",
  "review_sha256": "684b5ca526db401a0b0cbda8f90b0fcf4e77672aef395a9066481bf9ae7697ab",
  "left_prediction_sha256": "43f7a0cb4104ad23adf6b224c042551244f64efdd1729e1d4cc28c86f3dae34b",
  "right_prediction_sha256": "b6be66d47eb7d9d1d206a5d0b89f0e6716886d0b25e9d7e8b8005805414c9f01",
  "left_tracker_adapter": "iou_tracker_v1",
  "right_tracker_adapter": "synthetic_split_tracker_v1",
  "evidence_status": "relative_difference_available",
  "disagreement_link_count": 1,
  "reviewed_link_count": 1,
  "unreviewable_link_count": 0,
  "same_subject_link_count": 1,
  "different_subject_link_count": 0,
  "left_exclusive_link_count": 1,
  "right_exclusive_link_count": 0,
  "left_disagreement_error_count": 0,
  "right_disagreement_error_count": 1,
  "left_disagreement_error_rate": 0.0,
  "right_disagreement_error_rate": 1.0,
  "relative_preference": "left",
  "reviewer_count": 1,
  "scope": "pairwise_disagreement_links",
  "human_ground_truth": true,
  "overall_accuracy_evaluated": false,
  "shared_links_evaluated": false,
  "global_adapter_selected": false,
  "subject_identity_inference": false,
  "source_media_included": false,
  "paths_disclosed": false
}
